Question,Answer
What is cloud computing?,"Cloud computing is the delivery of computing services—servers, storage, databases, networking, software—over the internet (""the cloud"") to offer faster innovation, flexible resources, and economies of scale."
What are the main types of cloud computing?,"There are three main types:

Public cloud (shared infrastructure, like AWS, Azure)
Private cloud (used by one organization)
Hybrid cloud (mix of both, connected systems)"
"What is the difference between public, private, and hybrid clouds?","Public: Services delivered over the internet, shared among users.
Private: Exclusive cloud environment for one organization, often on-premise.
Hybrid: Combines both, allowing data/app sharing between them."
"What are IaaS, PaaS, and SaaS?","IaaS (Infrastructure as a Service): Virtual machines, storage (e.g., AWS EC2).
PaaS (Platform as a Service): Tools for building apps without managing hardware (e.g., Google App Engine).
SaaS (Software as a Service): Applications accessed via browser (e.g., Google Workspace, Dropbox)."
What is the difference between cloud and traditional hosting?,"Cloud offers scalability, pay-as-you-go pricing, and automation. Traditional hosting is fixed-capacity, often less flexible and more manual."
Why should I use cloud services?,"For scalability, lower upfront costs, faster deployment, global access, and built-in security features."
Is cloud hosting secure?,"Yes, major providers offer strong security (encryption, compliance, IAM), but you must configure it correctly."
How does cloud hosting work?,Your apps and data are hosted on virtual servers in data centers and delivered via the internet.
What is virtualization in cloud computing?,"Virtualization allows multiple virtual machines to run on a single physical server, improving resource use and flexibility."
What is a data center?,"A facility with physical servers, networking, and storage infrastructure that powers cloud services."
What are the top cloud providers?,"Amazon Web Services (AWS), Microsoft Azure, and Google Cloud Platform (GCP)."
What is AWS?,"Amazon Web Services offers a broad range of cloud services including compute, storage, networking, databases, AI, and more."
What is Microsoft Azure?,"Azure is Microsoft's cloud platform providing infrastructure, analytics, AI, DevOps, and integration with Microsoft services."
What is Google Cloud Platform (GCP)?,"GCP provides scalable cloud infrastructure, machine learning, and analytics, with strong support for containers and AI."
"How do AWS, Azure, and GCP differ?","AWS has the most services and global reach. Azure integrates well with Microsoft products. GCP excels in AI, data, and Kubernetes."
Are there free tiers on cloud platforms?,"Yes. AWS, Azure, and GCP offer free tiers with limited usage for beginners and small projects."
Which cloud provider is best for startups?,GCP and AWS often provide credits for startups. GCP is developer-friendly; AWS has more services.
Can I switch between cloud providers?,"Yes, but it may require reconfiguration or migration tools due to differences in platforms."
Do cloud providers offer SLAs?,"Yes, most offer Service Level Agreements with uptime guarantees (e.g., 99.9%)."
How do I compare pricing between cloud providers?,"Use pricing calculators offered by AWS, Azure, and GCP. Consider instance type, storage, data transfer, etc."
What is cloud storage?,"A service where data is stored in the cloud and accessed over the internet (e.g., Amazon S3, Google Cloud Storage)."
What is a virtual machine (VM)?,A software emulation of a physical computer running in the cloud.
What is serverless computing?,"You write code and the cloud runs it automatically—no need to manage servers (e.g., AWS Lambda)."
What is Kubernetes?,"An open-source platform to automate deployment, scaling, and management of containerized applications."
What is a container in cloud computing?,"A lightweight, portable package of software that includes everything needed to run the application."
What is a managed database service?,"A cloud service where the provider handles database maintenance, backups, and scaling (e.g., Amazon RDS)."
What is cloud backup?,The process of storing copies of data in the cloud for recovery in case of failure or data loss.
What is a load balancer in the cloud?,Distributes traffic across multiple servers to ensure reliability and performance.
What is object storage?,"A storage system where data is stored as objects, ideal for unstructured data (e.g., images, backups)."
What is CDN (Content Delivery Network) in cloud hosting?,A network of servers that cache content globally to deliver it faster to users.
How is cloud hosting billed?,"Usually billed based on usage: compute time, storage, data transfer."
What is pay-as-you-go pricing?,"You pay only for the resources you use, with no upfront commitment."
Can I set a spending limit?,"Yes, most platforms allow budget alerts and spending limits."
What is reserved instance pricing?,You commit to a specific instance type for 1-3 years for a lower price than on-demand.
How do I estimate my cloud bill?,Use the cloud provider’s cost calculator and monitor usage regularly.
Are there hidden charges in cloud hosting?,"Sometimes—e.g., data transfer, storage I/O, support plans—so always review billing details."
How can I reduce my cloud costs?,"Use autoscaling, right-size instances, reserved pricing, or spot instances."
What are billing alerts?,Notifications you set up to warn you when usage or costs exceed a threshold.
What happens if I exceed my budget?,You’ll be billed for the extra usage unless you set hard limits or account restrictions.
Do I need a credit card to use cloud services?,"Usually, yes—for verification and billing, even for free tiers."
How do I create a cloud account?,"Visit the provider’s site, sign up, and verify with a credit card or ID."
How do I deploy a website to the cloud?,Use a cloud compute instance or service like AWS S3 + CloudFront or Azure App Service.
Can I migrate my existing app to the cloud?,"Yes, using lift-and-shift or modernizing the app to fit the cloud environment."
What tools are needed to manage cloud resources?,"Cloud consoles, CLI tools, SDKs, Terraform, and monitoring dashboards."
What is cloud provisioning?,"Allocating cloud resources like VMs, storage, or networks, either manually or automatically."
Can I automate cloud deployments?,"Yes, using Infrastructure as Code tools (e.g., Terraform, AWS CloudFormation)."
What is Infrastructure as Code (IaC)?,Managing infrastructure via code/scripts for repeatable and automated deployments.
What is the difference between instance types?,"Instance types vary in CPU, memory, and storage for different workloads."
Can I schedule my cloud instances?,"Yes, using automation tools or scripts to start/stop instances based on time."
What are snapshots and how do I use them?,Snapshots are backups of disk volumes you can restore or clone.
Is my data safe in the cloud?,"Yes, if secured properly using encryption, IAM, backups, and secure configurations."
Who has access to my data in the cloud?,Only you and authorized users—unless permissions are misconfigured.
What is cloud encryption?,Encrypting data at rest and in transit to protect it from unauthorized access.
What is identity and access management (IAM)?,Framework to control who can access what resources in your cloud environment.
How do I secure a cloud server?,"Use firewalls, patch systems, enforce strong IAM policies, and enable monitoring."
What are firewalls in the cloud?,Virtual security rules that filter inbound/outbound traffic to your resources.
What is zero-trust security in cloud computing?,A model where no user or device is trusted by default—verification is required at every step.
Are cloud providers GDPR compliant?,"Yes, major providers support GDPR compliance, but configuration is your responsibility."
Can I audit cloud activity logs?,"Yes, cloud platforms offer logging services (e.g., AWS CloudTrail, Azure Monitor)."
How do I implement multi-factor authentication (MFA)?,Enable MFA from your account settings using an app like Google Authenticator.
Can cloud hosting handle traffic spikes?,"Yes, using auto-scaling and load balancing to adapt to demand."
What is auto-scaling?,Automatically adds or removes resources based on load or usage metrics.
How do I monitor my cloud app’s performance?,"Use built-in tools (CloudWatch, Azure Monitor) or third-party solutions like Datadog."
What is cloud latency?,Delay in data transmission. Reduced by using global servers or CDNs.
What is high availability in cloud hosting?,Designing systems to minimize downtime using redundant infrastructure.
Can I run real-time apps in the cloud?,"Yes, using managed services that support WebSockets, messaging, and low-latency networking."
How do I optimize cloud performance?,"Use caching, CDNs, optimized instance types, and monitor bottlenecks."
What are performance SLAs?,"Agreements that define expected performance (e.g., uptime, response time)."
How do I handle disaster recovery in the cloud?,"Set up backups, replication, and multi-region failover plans."
What is fault tolerance?,The ability of a system to continue operating despite failures.
How do I migrate my website to the cloud?,Copy your site files and database to a cloud server or use migration tools.
Can I move from shared hosting to the cloud?,"Yes, and you’ll gain more control, scalability, and performance."
Is downtime expected during migration?,"Possibly, but it can be minimized with proper planning and cut-over strategies."
What tools help with cloud migration?,"AWS Migration Hub, Azure Migrate, GCP Migrate, or third-party tools like CloudEndure."
How long does cloud migration take?,Depends on app complexity—hours to weeks typically.
Can I migrate my database to the cloud?,"Yes, using tools like AWS DMS, Azure Database Migration Service."
Will I lose data during migration?,Not if done properly with backups and validation.
What is lift-and-shift migration?,Moving an app to the cloud without changing its architecture.
What is re-platforming?,Moving to the cloud with some optimizations or using cloud-native services.
Can I rollback after a failed cloud migration?,"Yes, if you maintain backups and rollback plans."
What is CI/CD in cloud hosting?,Continuous Integration/Continuous Deployment automates testing and deployment of code.
How do I deploy from GitHub to the cloud?,"Use CI/CD tools like GitHub Actions, Jenkins, or cloud-native pipelines."
Can I use Docker in cloud environments?,"Yes, all major providers support containers and Docker."
What is a cloud development environment?,"An online IDE or setup hosted in the cloud for coding and collaboration (e.g., GitHub Codespaces)."
Do cloud services support API integrations?,"Yes, with RESTful APIs, SDKs, and webhooks for automation."
What IDEs work well with cloud platforms?,"VS Code, IntelliJ, PyCharm—all integrate well via extensions and plugins."
How do I manage secrets in the cloud?,"Use secret managers like AWS Secrets Manager, Azure Key Vault."
What is serverless framework?,An open-source framework to deploy and manage serverless functions easily.
Can I schedule cron jobs in the cloud?,"Yes, using services like AWS EventBridge, Azure Functions Timer Trigger."
"Do cloud providers support Python, Node.js, etc.?","Yes, they support major languages including Python, Node.js, Java, Go, .NET."
What is edge computing?,Running applications closer to users/devices to reduce latency and bandwidth use.
What is cloud-native architecture?,"Designing applications to fully leverage cloud features like microservices, containers, CI/CD."
What is a multi-cloud strategy?,Using services from more than one cloud provider to avoid vendor lock-in or improve resilience.
What is FinOps?,Cloud financial management—optimizing cloud spending and cost accountability.
What is green cloud computing?,Sustainable cloud practices focused on energy efficiency and reduced carbon footprint.
How does AI work in the cloud?,Cloud providers offer AI/ML services and infrastructure to train/deploy models at scale.
What is quantum computing in the cloud?,Cloud access to quantum processors for experimentation and advanced research.
What is cloud bursting?,Extending on-prem workloads to the cloud during peak demand.
Can blockchain run on the cloud?,"Yes, blockchain nodes and services can be hosted on cloud platforms."
What’s the future of cloud computing?,"Trends include edge computing, AI integration, multi-cloud, sustainability, and quantum computing."
how are you?,hi how can i help you today?
hi?,hi how can i help you today?